{
  "schemaVersion": 1,
  "name": "fungi-service-recipes",
  "description": "Experimental Fungi service manifest recipes.",
  "stability": "experimental",
  "recipes": [
    {
      "id": "filebrowser-lite",
      "name": "File Browser Lite",
      "description": "A lightweight File Browser build served as a Wasmtime-compatible WASI component.",
      "runtime": "wasmtime",
      "manifestPath": "recipes/filebrowser-lite/filebrowser-lite.fungi.md",
      "manifestAsset": "filebrowser-lite.fungi.md",
      "homepage": "https://github.com/enbop/filebrowser-lite",
      "tags": ["files", "web", "wasi", "wasmtime"],
      "stability": "experimental"
    },
    {
      "id": "socks5-wasip2",
      "name": "SOCKS5 WASIp2",
      "description": "An unauthenticated SOCKS5 TCP CONNECT proxy served as a Wasmtime-compatible WASI component.",
      "runtime": "wasmtime",
      "manifestPath": "recipes/socks5-wasip2/socks5-wasip2.fungi.md",
      "manifestAsset": "socks5-wasip2.fungi.md",
      "homepage": "https://github.com/enbop/socks5-wasip2",
      "tags": ["proxy", "socks5", "tcp", "wasi", "wasmtime"],
      "stability": "experimental"
    },
    {
      "id": "ssh-tunnel",
      "name": "SSH Tunnel",
      "description": "Expose an existing local SSH daemon on a target device as a Fungi TCP tunnel service.",
      "runtime": "tcp",
      "manifestPath": "recipes/ssh-tunnel/ssh-tunnel.fungi.md",
      "manifestAsset": "ssh-tunnel.fungi.md",
      "homepage": "https://www.openssh.com/",
      "tags": ["ssh", "tcp", "tunnel"],
      "stability": "experimental"
    },
    {
      "id": "webdav",
      "name": "WebDAV",
      "description": "A WebDAV server served as a Wasmtime-compatible WASI component.",
      "runtime": "wasmtime",
      "manifestPath": "recipes/webdav/webdav.fungi.md",
      "manifestAsset": "webdav.fungi.md",
      "homepage": "https://github.com/enbop/webdav-wasi",
      "tags": ["files", "webdav", "tcp", "wasi", "wasmtime"],
      "stability": "experimental"
    }
  ]
}
